ISBN,書籍簡介
9789571188850,"  
	聲韻學的知識不但是通讀古書的重要基礎，也是欣賞文學作品的重要工具，更是所有治文史的學者們應該具備的重要法門。自古以來，聲韻學的知識稱之為「小學」，即「基礎學科」，正強調了這門知識的重要性。

本書特色

	1.本書包括五編二十六章，內容涵蓋什麼是聲韻學、古音的分期、反映明清時代官話的韻書和韻圖、通音與悟道─佛經翻譯對聲韻學的影響、四十三圖的等韻模型─拼音表的緣起、中古音到現代的演化、古聲母的十個條例、聲韻學與華語文教學、聲韻學和破音字的鑑別……等。

	2.聲韻學是一門講求客觀的科學，需要不斷隨著該領域研究的進展同步更新，才能使學生有機會接觸新訊息，而不是在舊資料中打轉。

	3.本書在呈現方式上力求更通俗化，期使以深入淺出、圖表說明等方式,讓每一個人都能看懂、學好聲韻學。

	本書作者任教聲韻學已超過四十年，期使以此新的聲韻學教材，加上通俗性、趣味性，使同學們能夠從中發現聲韻學的實用性，並在學理的基礎上對古典詩歌的賞析、華語教學的應用發揮一些作用。 "
9789862956038,"  
本書特色

	華語遠距同步課程具備的要素為：同步教室、華語教師及參與學生，因此三要素所引發的四方互動，包括學習者與同步平台、學習者與教師、學習者與教材、學習者之間的互動，如何在同步教學實務中進行有效之高互動設計，成為本書的核心導引方向。本書提出同步教學設計四方互動線上帶領作為專業能力指標，並以筆者與國外學校合作之同步課程為應用示例，進一步探究四方互動具體之教學設計，前六章著重於如何開始華語同步教學、同步教學法與教學設計、同步教學活動設計；後四章則著重於華語同步教學教材之模組化應用、同步教學教材之分析與設計、同步教學教材之發展與製作。從教學面向至教材面向、從教學設計至活動設計，皆嘗試透過實務操作之導引，以及四方互動設計之融入，讓讀者理解華語同步教學的具體作法，藉此導引逐步領略華語同步教學之堂奧。 "
9789862955529,"  
本書特色

	《專業華語概論》是一部介紹專門用途華語教學的概論性專著，內容包含商務華語概論、新聞華語概論、中醫華語概論、導遊華語概論、旅遊華語概論、科技華語概論、法律華語概論、基督教華語概論。

	本書歸納知識框架，盡可能整理相關專業華語教材，概括性地介紹相關研究成果，讀者可以通過所附教材與參考文獻，進一步了解相關理論及其具體內容；本書同時聯繫實務進行交流與討論，聯繫具體的材料，以及親身經驗等來理解，至於一些複雜、爭議的問題，可以藉由每章後面的「本章回顧與反思」，進行思考與討論。 "
9789861477275," 這是一本探討漢字由簡化型態翻轉回歸正體型態的專書。它對簡化字使用者和學習者而言，將簡化字轉換成正體字的認讀和習寫，在理論和實用上可以產生相當有效的助益。在華語文教學的認讀和習寫方面，它也是一本至今較為難得一見的著作。本書旨在探討漢字由簡轉繁的規律和方法，並且建構有系統的教學策略，為簡化字的使用者和學習者指出一條由簡轉繁，以加強漢字識別能力的途徑。作者運用分析、歸納、辯證、綜合等科學方法的研究和驗證，建構了簡轉繁的轉換公式，如：(1) 偏旁部首的轉換公式，這是將14 個簡化偏旁的「讠」、「钅」、「纟」等還原為「言」、「金」、「糸」等，且只能置於整字的「讠」左邊，位於其他部位或單獨成字時則未簡化。(2) 類推轉換公式，例如將未轉化的部件「女」和已簡化的部件「馬」結合而成的「妈」字還原為「媽」字，將均已簡化的马、佥結合而成的「验」字還原為「驗」字。(3) 部件增減轉換公式，例如將簡化字的「儿」和其他部件的「臼」字結合還原為「兒」字，將簡化字的「从」和其他部件的「彳、」結合還原為「從」。(4) 部件轉換公式，例如將繁體形符「虫」和簡化聲符「下」結合形成的「虾」字還原為「蝦」字，將本為形符「山」和簡化聲符「仑」結合，又因同音兼代而呈現的「仑」還原為「崙」。除了建構公式以呈現簡轉繁的規律性以外，還就簡轉繁的差異性分為字型結構的差異和簡轉繁造字法的差異，逐項加以綜合分析，使人明白其道理所在，如此簡轉繁的理論和實踐方法便愈為清楚了。相信簡化字的使用者或學習者，如果想對「簡轉繁」的理論和實踐進行理解和研究，本書將可提供甚為明確的參考價值。 "
9789861476674," 網際網路於二十一世紀起躍升為人際互動的重要場域，網路社會儼然成形。這種語境開展全新的語言模式，催生豐富的多語材料，觸發更深更廣的跨文化交流，因此當中的語言現象形成現代語言學理論與實踐之寶貴資源。本書的主旨即為對比漢語與英語於網路社會運用的語用策略，歸納網路溝通所遵循之文化規約，期望分析結果對當今數位化、國際化的語言研究與教學有所啟發。 "
9789570846591,"  
華語教學最權威──國立臺灣師範大學國語教學中心　編寫開發
最符合當代華語學習趨勢的教學用書
讓中文課程走出新的未來、新的視野

	 
系列規劃

	全系列教材共六冊，為全方位訓練學生華語能力的教材。前三冊以口語訓練為主，後三冊開始進入書面語訓練。
	 
	第一冊著重在實際日常生活對話運用，第二冊開始輔以短文閱讀，第三冊則從長篇對話進入書面語及篇章的訓練，第四冊以篇章方式對書面語做更進一步的加強訓練，培養學生具備閱讀真實語料的語言實力。第五、六冊則涵蓋社會、科技、經濟、政治、文化、環境等多元議題探討，擴展學生對不同領域的語言運用。
	 
	各冊教材分別包含課本、作業本、教師手冊及漢字練習簿（第一、二冊）。
	 
程度規劃

	本系列教材適合來台學習華語學生，並適用於海外高中或大學學習華語的學生。一～六冊的程度規劃相當於 CEFR 的 A1-C1 等級或 ACTFL 的 Novice-Superior 等級。
	 
本書特色

	符合現代教學潮流，結合溝通式教學和任務導向學習，培養學生使用華語的能力。
	每課開始的學習目標和課末的學習自評表，幫助學習者了解自己是否達成學習目標。
	課文緊貼日常生活真實情況，使學生在自然的語境下學習華語。
	採用新思維漢語教學詞類架構及語法說明，有效防堵學習者偏誤產生。
	語法說明包括語法功能、結構、語用、練習四個部分，輔助學習者正確地使用語言。
	課室活動提供明確的學習目標、活動或任務，透過有趣的活動練習鞏固學習。
	「文化」單元輔以真實的照片，使學習者能深入瞭解臺灣當地社會文化。
	提供線上輔助工具，協助教師課堂教學輔助及學習者之課後練習。
	 
Introduction

	This six-volume series is a comprehensive learning material that focuses on spoken language in the first three volumes and written language in the latter three volumes. Volume One aims to strengthen daily conversation and applications; Volume Two contains short essays as supplementary readings; Volume Three introduces beginning-level written language and discourse, in addition to extended dialogues. Volume Four uses discourse to solidify the learner’s written language and ability in reading authentic materials; Volumes Five and Six are arranged in topics such as society, technology, economics, politics, culture, and environment to help the learner expand their language utilisations in different domains.

	Each volume includes a textbook, a student workbook, and a teacher’s manual.  In addition, Volume One and Two include a practice book for characters.
	 
Level of Students

	A Course in Contemporary Chinese 《當代中文課程》 is suitable for learners of Chinese in Taiwan, as well as for high school or college level Chinese language courses overseas. Volumes One to Six cover levels A1 to C1 in the CEFR, or Novice to Superior levels in ACTFL Guidelines
	 
Overview

	The series adopts communicative language teaching and task-based learning to boost the learner’s Chinese ability.
	Each lesson has learning objectives and self-evaluation to give the learner a clear record of tasks completed.
	Lessons are authentic daily situations to help the learner learn in natural contexts.
	Lexical items and syntactic structures are presented and explained in functional, not structural, perspectives.
	Syntactic, i.e. grammatical, explanation includes functions, structures, pragmatics, and drills to guide the learner to proper usage.
	Classroom activities have specific learning objectives, activities, or tasks to help fortify learning while having fun.
	The “Bits of Chinese Culture” section of the lesson has authentic photographs to give the learner a deeper look at local Taiwanese culture.
	Online access provides supplementary materials for teachers & students. "
9789862954911," 本書一共分為十五章，不僅從年齡、行為、認知、教學法、語用、溝通、課室言談、閱讀、中介語、石化、社會文化、語言規劃、教育科技、漢學及教材等內容討論第二語言習得領域的本體論，也透過這些內容延伸出跨領域結合的當代應用與未來可能性。 "
9789862954621," 本書以跨文化溝通融入華語文教學之理論基礎與實務應用為主軸，進行研究與分析，兼顧華語文領域的跨文化溝通教學理論發展與教學實踐，在理論的部分以能力本位出發，分別探討華語文跨文化溝通能力的本質特色、習得基礎以及教學內涵，以提供華語文跨文化溝通教學研究之參考；在實務部分，本書分別於國際課程大綱、教學策略、教材設計以及測驗評量等面向提供教學應用與建議，除各式練習題與測驗評量工具的整理外，並附上教學實例與教案範例進行說明，適合師資培訓與教學實務之參考。目的在推廣華語文跨文化溝通教學的研究與教學實踐，以期促進華語文跨文化溝通教學與研究領域的發展。 "
9789570845709,"  
華語教學最權威──國立臺灣師範大學國語教學中心　編寫開發

最符合當代華語學習趨勢的教學用書

讓中文課程走出新的未來、新的視野

  

系列規劃

 全系列教材共六冊，為全方位訓練學生華語能力的教材。前三冊以口語訓練為主，後三冊開始進入書面語訓練。

 第一冊著重在實際日常生活對話運用，第二冊開始輔以短文閱讀，第三冊則從長篇對話進入書面語及篇章的訓練，第四冊以篇章方式對書面語做更進一步的加強訓練，培養學生具備閱讀真實語料的語言實力。第五、六冊則涵蓋社會、科技、經濟、政治、文化、環境等多元議題探討，擴展學生對不同領域的語言運用。

 各冊教材分別包含課本、作業本、教師手冊及漢字練習簿（第一、二冊）。

  

程度規劃

 本系列教材適合來台學習華語學生，並適用於海外高中或大學學習華語的學生。一至六冊的程度規劃相當於CEFR的A1-C1等級或ACTFL的Novice-Superior等級。

  

特色

 符合現代教學潮流，結合溝通式教學和任務導向學習，培養學生使用華語的能力。

 每課開始的學習目標和課末的學習自評表，幫助學習者了解自己是否達成學習目標。

 課文緊貼日常生活真實情況，使學生在自然的語境下學習華語。

 採用新思維漢語教學詞類架構及語法說明，有效防堵學習者偏誤產生。

 語法說明包括語法功能、結構、語用、練習四個部分，輔助學習者正確地使用語言。

 課室活動提供明確的學習目標、活動或任務，透過有趣的活動練習鞏固學習。

 「文化」單元輔以真實的照片，使學習者能深入瞭解臺灣當地社會文化。

 提供線上輔助工具，協助教師課堂教學輔助及學習者之課後練習。

  

Introduction

 This six-volume series is a comprehensive learning material that focuses on spoken language in the first three volumes and written language in the latter three volumes. Volume One aims to strengthen daily conversation and applications; Volume Two contains short essays as supplementary readings; Volume Three introduces beginning-level written language and discourse, in addition to extended dialogues. Volume Four uses discourse to solidify the learner’s written language and ability in reading authentic materials; Volumes Five and Six are arranged in topics such as society, technology, economics, politics, culture, and environment to help the learner expand their language utilisations in different domains.

 Each volume includes a textbook, a student workbook, and a teacher’s manual.  In addition, Volume One and Two include a practice book for characters.

        

Level of Students

 A Course in Contemporary Chinese 《當代中文課程》 is suitable for learners of Chinese in Taiwan, as well as for high school or college level Chinese language courses overseas. Volumes One to Six cover levels A1 to B2 in the CEFR, or Novice to Advanced levels in ACTFL Guidelines

  

Overview

 The series adopts communicative language teaching and task-based learning to boost the learner’s Chinese ability.

 Each lesson has learning objectives and self-evaluation to give the learner a clear record of tasks completed.

 Lessons are authentic daily situations to help the learner learn in natural contexts.

 Lexical items and syntactic structures are presented and explained in functional, not structural, perspectives.

 Syntactic, i.e. grammatical, explanation includes functions, structures, pragmatics, and drills to guide the learner to proper usage.

 Classroom activities have specific learning objectives, activities, or tasks to help fortify learning while having fun.

 The “Bits of Chinese Culture” section of the lesson has authentic photographs to give the learner a deeper look at local Taiwanese culture.

 Online access provides supplementary materials for teachers & students. "
9789861476803," 本書共分兩大部分。第一部分為思考能力的理論、政策、與課程，共有四篇文章：第一篇探討批判思考的理念架構及其在英語教學的應用；第二篇探討創意思考的理論與其在英語教學的實踐；第三篇由高中英文課程政策探討思考能力之實踐；第四章探討思考能力如何落實於教科書的內容。本書之第二部分則以思考教學與評量實務為主軸，以五篇文章探討英語教學中如何提升學生思考能力，第一篇文章分享文學小圈圈教學活動如何提升高中學生思考能力；第二篇文章則介紹「質疑作者法」之閱讀教學策略；第三篇文章探討以同儕文學討論方式培養五專學生思考能力；第四篇文章以一項「思辨和英語論辯推廣計畫」為例，說明提升高中學生思考能力之可行面向與做法；第五篇文章則分析近年大學入學測驗試題，了解思考能力如何在大型考試中評量。藉由以上九篇文章，本書希望能分析近年來在中等學校推動思考能力教學的背景、政策，同時也分享教學實例，希望能進一步深化思考能力教學，提升青年學子在國際上的競爭力。        相信無論是英語教育學者或是第一線的英語文教師，在閱讀本書後應該會對「透過英語文學習培養思考力」這個主題有新的體認與反思。 "
9789863760047," 編者在大學教授「國音」與華語文中心語音學多年，將授課資料內容分門別類，遴選「語音學教材」，並提出要旨，期透過有條不紊的整理，有助於讀者進修與學習，並提供給外籍人士學習華語文的門徑。書中並收錄教育部對外華語教學能力認證考試試題，並列出答案以供讀者參考。 "
9789862954331," 許多人存在一個觀念，以為說國語不就是依著習慣來說嗎？其實準確的發音是需要經過訓練的。漢語語音的正音，需要一本真正能夠持標準國語發音，且又為研究語音學之研究者來撰寫，才能掌握漢字音韻的每一個聲母、韻母的正確讀音，以及語彙間的連音變化、語詞和虛字的準確音讀。本書之編寫即依此構想作整體規劃，由漢語語音的基本介紹，到聲母、韻母的音讀分析及練習，再到詞彙、語句的連音及變調、ㄦ化及輕聲的練習導引，系統的對漢語音韻的有關知識進行了陳述。隨書附贈朗讀示範CD！ "
9789570919431,"  
	語音是學習第二語言或外語的第一步，任何學習語言的人都必須先學會語音，才能步入語法或句法的學習。想成為華語教師，不但要具備語音知識，更需要了解語音的教學原理、相關研究、及教學實務應用技巧。透過本書，華語教師便可了解只要具備對於語音的一些必備知識，及掌握學習者母語的語音知識，華語教師們不是語音學家亦能提升華語語音教學的成效。

	 

本書特色

	 

	1.解析華語語音組成結構

	2.說明華語聲調及兒化韻

	3.討論華語語音教學議題 "
9789571177878,"  
全書分成五個章節：

	第一章，華語文教學之內涵與現況，主要說明華語文教育的定義、目標、課程、教材、測驗，以及目前師資培育的情形。

	第二章，華語文教學之理論基礎，主要從教育哲學和教育心理學的角度，探討華語文教學所涉及的基本問題。

	第三章，華語文教學之課程原理，簡介課程的基本概念，並說明華語文課程設計的原理原則。

	第四章，華語文教學之教學原理，簡介教學的基本概念，並說明各種教學方法在華語文領域的應用。

	第五章，華語文教學之評量原理，簡介評量的基本概念，並舉例說明聽、讀、說、寫各類試題應如何設計。 "
9789570843675,"  
想要累積、擴充你的中文字庫？
 每日一字，每天好好學一個漢字吧！
 手持大小的隨身書，讓你輕鬆攜帶隨身閱讀。

 每天認識一個漢字，及其字形演變、筆順、解釋、相關詞例，天天累積，打好漢字基礎。

 Having problems building up your vocabulary of Chinese characters ?

 You can do it by learning one character a day !

 This simple, illustrated book is designed to help you learn one Chinese character a day and provides information on character evolution and stroke order as well as explanations, related terms, and example sentences.

 By studying one character and a minimum of two related terms each day, you will learn some 1000 words in just one year !

本書特色：

 每日一字，一年輕鬆累積 365 個漢字，1000 多個詞彙。

 每個字包含正／簡體、手寫體、漢語拼音、注音符號、字形演變、筆劃順序、詞例、中英文解釋、例句、輔助插圖。

 手掌寬度的手持尺寸設計，隨時隨地都方便攜帶閱讀。

 附贈 MP3 光碟，幫助學習每個漢字同時增進聽力。

 拼音索引方便日後查找。

Features:

 The book teaches one Chinese character and two to five terms each day for a total of some 1000 in a year.

 Characters are written in traditional, simplified, and handwritten script and come with illustrations, pinyin, Mandarin phonetic symbols, English explanations, related terms, and example sentences.

 The book's small size allows you to read it wherever you go.

 An MP3 disk is included to enhance listening skills as you study each character.

 An index based on the pinyin spelling of the characters makes it easier to look up characters in the book.
   "
9789861472805," 為了培養專業華語教學人才，台灣各大學近年來陸續成立應用華語文學系，或開設華語文教學學程，中華文化史是專業修習的課程，教育部在二○○六年開始舉辦「對外華語教學能力認證考試」，「華人社會與文化」正是必考的科目。 本書是由四位各具專長的學者，共同研討合作而成書。內容深入淺出，希望能提供讀者對中華文化清晰的認知，進一步在回顧數千年文化長流的過程中，矚望前景，將中華文化體系，融入人類文化體系之中，以其包容的特性和消化吸收的能力，不求獨步全球，但望引領世界走向理想的未來。 (17x23cm/約333頁/單色印刷/2009年2月出版) "
9789570919363,"  
 本書主要關注的對象為海外兒童，包括國內外幼稚園到中小學階段的學生，以及海外華裔學童在海外各種學校裡的華語學習。針對兒童初級華語階段的各項基礎教學理念、教材編寫與活動設計，從兒童聽力與口說教學、寫字與識字教學、兒童閱讀與寫作教學、兒童戲劇教學與繪本教學等，提供兒童華語教學原則、教學模式與教學策略，使海內外從事兒童華語文教學的工作者，藉此能夠透過不同的教學方式更深入的進行教學活動，以達到良好的教學成效。 "
9789862952207,"  
本書特色

 本書按照華語的語音系統，從音節的構成成分──聲母、韻母、聲調到詞語，再到句子層面，找出不同留學生的發音難點，並選取了歐美、日本、韓國、新加坡四種不同母語的留學生作為研究對象，較全面地反映出外國學生「洋腔洋調」的特點；既有專供華語教師參考的教學建議，也有專為學生自學設計的各種練習，極具實用性與針對性。

 本書運用現代語音學原理，借助生理、物理、心理實驗方法進行研究，不僅有其科學價值，更從理論和實踐兩個方面，給予華語研究者、華語教師與華語學習者適切的指導，適合作為華語師資培育的教科書以及華語自學指導書。 "
9789570919233," 一般教師常為了學習活動而腸枯思竭，每次只有那麼幾招，久了也沒了新意，反覆操作後，總要再汲取更多的創意。初入門的教師，也常在設計課程活動時，想盡各種方法，參考各類圖書，但總無法適切使用在自己的班上。教學從整個觀點，到教學方法而落實到教學活動與技巧，此箇中學問既深且廣，許多新手教師在未登上教學台時，總是信心滿滿的認為自己是這個舞台上的主角或是領導者，一定能夠掌控全局，但往往下了課後卻像戰敗的公雞一般，對不受控制的學生舉白旗投降，尤其是對於華語教師來說，面對的是一群和自己說著不同母語的學生，課堂教學的難度更是提升了！本書分別以語文技能－聽、說、讀、寫、綜合、文化等能力而分，也依據不同背景學習，不同程度與專業目標而記錄，並推薦使用方式，同時，各活動說明重要的準備階段與實施注意事項。本書編寫上百則短小的教學技巧，主要為提供華語教師較具體實用的、富有趣味性的、易於操作的課堂教學方法、技巧與遊戲，以提升課堂教學品質與氣氛。因內容豐富，因此規劃為上下兩冊，期能成為華語老師教學時的實用工具書。本書以華語文教學為主要的範圍，也可以應用在其他語文或中文為母語的教學活動上。藉由此書的活動發展，期望能讓華語文教學更有趣有效而生動活潑。 "
9789570919240," 一般教師常為了學習活動而腸枯思竭，每次只有那麼幾招，久了也沒了新意，反覆操作後，總要再汲取更多的創意。初入門的教師，也常在設計課程活動時，想盡各種方法，參考各類圖書，但總無法適切使用在自己的班上。教學從整個觀點，到教學方法而落實到教學活動與技巧，此箇中學問既深且廣，許多新手教師在未登上教學台時，總是信心滿滿的認為自己是這個舞台上的主角或是領導者，一定能夠掌控全局，但往往下了課後卻像戰敗的公雞一般，對不受控制的學生舉白旗投降，尤其是對於華語教師來說，面對的是一群和自己說著不同母語的學生，課堂教學的難度更是提升了！本書分別以語文技能－聽、說、讀、寫、綜合、文化等能力而分，也依據不同背景學習，不同程度與專業目標而記錄，並推薦使用方式，同時，各活動說明重要的準備階段與實施注意事項。本書編寫上百則短小的教學技巧，主要為提供華語教師較具體實用的、富有趣味性的、易於操作的課堂教學方法、技巧與遊戲，以提升課堂教學品質與氣氛。因內容豐富，因此規劃為上下兩冊，期能成為華語老師教學時的實用工具書。本書以華語文教學為主要的範圍，也可以應用在其他語文或中文為母語的教學活動上。藉由此書的活動發展，期望能讓華語文教學更有趣有效而生動活潑。 "
